restId,name,cuisine,aggregate_rating,rating_votes,dining_rating,dining_review_count,delivery_rating,delivery_review_count,timing,people_say,top_dishes,address,location_longitude,location_latitude,url,cost_for_two
18425264,Sahana Veg Restaurant,"North Indian, Chinese, Desserts",3.9,389,3.9,389.0,4.2,145,"12noon – 4pm, 7pm – 11pm (Today)","Good for Large Groups, Relaxed Atmosphere, Decent Ambience, Interior, Courteous Staff, Family Crowd","Ghee Chapati, Chaas, Thali, Gulab Jamun, Roti, Starter","Shop 6, GLR 390/806, First Floor East Street, MG Road, Pune",73.879525,18.5165167,https://www.zomato.com/pune/sahana-veg-restaurant-mg-road,₹700 for two people (approx.)
18672611,द Vege टेबल,"North Indian, Continental, Italian, Mughlai, Desserts, Beverages",4.3,1365,4.3,1365.0,4.2,1565,"11am – 4pm, 7pm – 10pm (Today)","Family Favorite, Ambiance and Music, Service is Great, Service and Quality of Food, Cozy Ambience, Staff Behaviour","Jumbo Veg Platter, Blueberry Mojito, Masala Corn, Vegetable Platter, Paneer Peshawari, Cheese Poppers","Survey 1251/2, Near Champion Sports, Shivaji Nagar, Pune",73.8422015551,18.516871436,https://www.zomato.com/pune/vege-shivaji-nagar,₹700 for two people (approx.)
18728916,AB's - Absolute Barbecues,"North Indian, BBQ, Fast Food, Desserts",4.6,2118,4.6,2118.0,3.6,265,10:30am – 11pm (Today),"Nice Food Nice Service, Live Grill, Awesome Vibe, Great Food Great Service, Loved it, Ample Seating Area","Nihari Gosht, Rabbit, Strawberry Pastry, Duck, Sea Food, Noodle","Unit 10, 11 & 12, Mariplex Mall, Kalyani Nagar, Pune",73.9065762609,18.5457661038,https://www.zomato.com/pune/abs-absolute-barbecues-kalyani-nagar,"₹1,200 for two people (approx.)"
6508395,Fatcook,"Italian, Chinese, North Indian, Mexican, Lebanese",4.3,917,4.3,917.0,3.8,1522,"12noon – 3:30pm, 7pm – 11pm (Today)","Peaceful Ambience, Service and Quality of Food, Comfortable Seating Area, Cosy Place, Pure Veg, Courteous Staff","Masala Karari Roti, Masala Garlic Bread, Tomato Dhaniya Shorba, Peas Pulao, Cheese Fingers, Lemon Coriander","17/2/1, Baner-Balewadi Road, Opposite Aditya Shagun Society, Baner, Pune",73.7811809778,18.5702374275,https://www.zomato.com/pune/fatcook-baner,₹600 for two people (approx.)
10232,Squisito,"Italian, Mexican, Salad, Beverages",4.4,980,4.4,980.0,4.1,1712,12noon – 11pm (Today),"Pure Veg, Favorite Place, Decent Ambience, Cozy Place, Server, Interior","Spinach Ravioli, Cheese Fondue, Risotto, Lasagne, Pastas, Hummus","1, Jewel Tower, Lane 5, Koregaon Park, Pune",73.897186853,18.5362905972,https://www.zomato.com/pune/squisito-koregaon-park,"₹1,500 for two people (approx.)"
6505874,Spice Factory,"North Indian, Chinese, Mughlai, Beverages",4.1,2292,4.1,2292.0,3.8,3896,12noon – 2am (Today),"Good Food and Good Service, Music and Ambience, Rooftop Ambience, Candle Light Dinner, Nice View, Ambience was Super Cool","Shanghai Chicken, Veg Fried Rice, Paneer Lababdar, Butter Garlic Prawns, Sizzling Brownie, Veg Crispy","Near ICICI Bank, 3rd Floor, Goodwill Landmarks, Kharadi, Pune",73.9364916086,18.5482320843,https://www.zomato.com/pune/spice-factory-kharadi,"₹2,000 for two people (approx.) Without alcohol"
11747,RushHrs,"Burger, Fast Food",4.0,727,4.0,727.0,4.2,16.9K,10am – 4am (Today),"Pocket Friendly, Combos, Great Value, Concept, Decent Place, Quick Service","Mutton Bomber, Chic Burger, Chicken Nuggets, Wraps, Iced Tea, Salads","Shop 5, Suyash Com Mall, Pancard Club Entrance Road, Near Union Bank of India, Baner, Pune",73.7837005779,18.5617689133,https://www.zomato.com/pune/rushhrs-baner,₹400 for two people (approx.)
6503538,RushHrs,"Burger, Fast Food",4.0,332,4.0,332.0,4.2,11K,8am – 4am (Today),"Inexpensive, Portion, Good Taste, Good Service, Food, Staff","Spicy Burger, Wraps, Iced Tea, Fries","Shop K 106, Ground Floor, Mega Center, Near Noble Hospital, Magarpatta, Pune",73.9263501763,18.5043922119,https://www.zomato.com/pune/rushhrs-magarpatta,₹350 for two people (approx.)
10614,Juice Destination,"North Indian, Sandwich, Salad, Juices, Beverages, Shake",3.9,289,3.9,289.0,3.9,6874,10am – 10pm (Today),"Meals, Decent Place, Reasonable Price, Good Quantity, Management, Awesome Food","Mixed Fruit Juice, Paneer Salad, Juices, Aloo Paratha, Veg Thali, Lassi","Shop 1, The Meal House, E Block, Chaitraban Society, Seasons Road, Opposite Croma Mall, Aundh, Pune",73.8068366423,18.5534496865,https://www.zomato.com/pune/juice-destination-aundh,₹400 for two people (approx.)
19260870,JZ Lake View Resto Bar,"North Indian, Continental, Asian, Beverages",4.2,384,4.2,384.0,3.8,17,12noon – 12midnight (Today),"Excellent Food and Service, Ambience was Super Cool, Outdoor Seating, Weekend Brunch, Beautiful Place, Polite Staff","Salads, Cheesecake, Cocktails, Buffet, Desserts, Pasta","Gate 190, Mulshi & Vella, Bhugaon, Pune",73.7341306731,18.4974679282,https://www.zomato.com/pune/jz-lake-view-resto-bar-bhugaon,"₹1,600 for two people (approx.) with alcohol"
19091921,Pind Punjab,"North Indian, Kebab, Chinese, Mughlai, Desserts",3.7,214,3.7,214.0,3.9,12.2K,11am – 11pm (Today),"Taste was Awesome, Order Online, Cutlery, Nice Taste, Good Quality Food, Hygiene","Jalebi with Rabri, Dalmakhani, Veg Thali, Butter Naan, Lassi, Gulab Jamun","Shop 1, Plot 5, Sairang Woods, Hinjawadi, Pune",73.7214847282,18.5948959046,https://www.zomato.com/pune/pind-punjab-hinjawadi,₹800 for two people (approx.)
10707,Aroma's Hyderabad House,"Biryani, Mughlai, Chinese, Kebab, North Indian, Seafood, Beverages",4.0,462,4.0,462.0,4.1,7695,"11:30am – 5pm, 7pm – 11pm (Today)","Tandoori, Great Taste, Spicy, Good Ambience, Value for Money, Packing","Chicken Dum Biryani, Raita, Kebabs, Chicken","Survey 11/4, Butte Bhavan, Nal Stop, Karve Road, Opposite Kasat Saree Centre, Erandwane, Pune",73.833186999,18.509546612,https://www.zomato.com/pune/aromas-hyderabad-house-erandwane,"₹1,100 for two people (approx.)"
18638204,Nina Pinta Santamaria,"North Indian, Desserts",3.8,4,3.8,4.0,4.5,1334,"11:30am – 3pm, 5:30pm – 10:30pm (Today)","Food on the Go, Concept, Portion Size, Nice Place, Prices, Value for Money","Dessert Crepe, Chicken Crepe, Savoury Crepe, Mushroom Crepe, Sweet Butter Chicken, Paneer Bhurji","1225/1, Venus Stationary Lane, Ganeshwadi, Apte Road, Deccan Gymkhana, Pune",73.8423753092,18.5197893247,https://www.zomato.com/nina-pinta-santamaria-food-tru,₹400 for two people (approx.)
11019,Ghar Ka Khana,"North Indian, Chinese, Kebab, Biryani, Beverages",3.8,327,3.8,327.0,4.0,677,"11am – 3:30pm, 6pm – 11pm (Today)","Meals, Decent Place, Portions, Great Ambience, Tasty, Location","Kheer, Lassi, Parathas, Chicken","Opposite Mindtree, Rajiv Gandhi IT Park, Hinjawadi, Pune",73.7334705,18.5941242,https://www.zomato.com/pune/ghar-ka-khana-hinjawadi,₹800 for two people (approx.)
6504734,Qabil-E-Tareef,"Lebanese, North Indian, Seafood, Mughlai",4.3,2515,4.3,2515.0,3.9,3860,12noon – 11pm (Today),"Peaceful Environment, Unique Ambience, Live Kitchen, Welcoming Staff, Wonderful Ambience, Best Hotel","Mango Bloom, Dal Akbari, Paneer Jaipuri, Paneer Shabnam, Matka Rabdi, Pan Kulfi","Shop 173/1 & 2, Shiv Sai Road, Near Lotus Hospital, Pimple Saudagar, Pune",73.7941953912,18.5994800455,https://www.zomato.com/pune/qabil-e-tareef-pimple-saudagar,"₹1,200 for two people (approx.)"
18315289,Yo Kakke,"North Indian, Street Food, Beverages",4.0,297,4.0,297.0,3.9,11.3K,"11am – 3:30pm, 6pm – 11pm (Today)","Reasonable Prices, Food Taste, Packing, Good Food, Price, Service","Authentic Punjabi Food, Chaas, Chole Bhature, Kulcha, Dal Makhni, Lassi","Shop 4, Garnets Bay, Nagar Road, Viman Nagar, Pune",73.921782,18.562656,https://www.zomato.com/pune/yo-kakke-viman-nagar,₹300 for two people (approx.)
18514639,Farmaaish,"Continental, Mughlai, North Indian, Biryani, Asian, Beverages",4.1,684,4.1,684.0,3.1,434,12noon – 1am (Today),"Thoughtful and Polite Staff, No Cover Charge, Good Offers, Live Music, Dj, Beautiful Ambience","Veg Fritters, Masala Chicken Lollipop, Beer, Drinks, Starters, Biryani","3rd Floor, A Wing, Lunkad Sky Cruise, Viman Nagar, Pune",73.9105921984,18.5657990186,https://www.zomato.com/pune/farmaaish-1-viman-nagar,"₹1,100 for two people (approx.) Without alcohol"
18315289,Yo Kakke,"North Indian, Street Food, Beverages",4.0,297,4.0,297.0,3.9,11.3K,"11am – 3:30pm, 6pm – 11pm (Today)","Reasonable Prices, Food Taste, Packing, Good Food, Price, Service","Authentic Punjabi Food, Chaas, Chole Bhature, Kulcha, Dal Makhni, Lassi","Shop 4, Garnets Bay, Nagar Road, Viman Nagar, Pune",73.921782,18.562656,https://www.zomato.com/pune/yo-kakke-viman-nagar,₹300 for two people (approx.)
18514639,Farmaaish,"Continental, Mughlai, North Indian, Biryani, Asian, Beverages",4.1,684,4.1,684.0,3.1,434,12noon – 1am (Today),"Thoughtful and Polite Staff, No Cover Charge, Good Offers, Live Music, Dj, Beautiful Ambience","Veg Fritters, Masala Chicken Lollipop, Beer, Drinks, Starters, Biryani","3rd Floor, A Wing, Lunkad Sky Cruise, Viman Nagar, Pune",73.9105921984,18.5657990186,https://www.zomato.com/pune/farmaaish-1-viman-nagar,"₹1,100 for two people (approx.) Without alcohol"
13278,Cafe Eastwood,"North Indian, Continental, Italian, Fast Food, Chinese, Beverages",4.0,801,4.0,801.0,4.2,463,"11am – 4pm, 7pm – 11pm (Today)","Food Service, Nice Music, Great Music, Cozy Place, Reasonable Rates, Decent Place","Chicken Steak, Cocktails, Nachos, Drink, Fish, Snacks","5/6, Chintamani Pride, Kothrud, Pune",73.8189655915,18.4987823491,https://www.zomato.com/pune/cafe-eastwood-kothrud,"₹1,500 for two people (approx.) Without alcohol"
18721569,The Bar Tales,"American, North Indian, Chinese",4.0,305,4.0,305.0,4.0,339,"12noon – 3:30pm, 7pm – 11pm (Today)","Classy Place, Rooftop Ambience, Bar, Nice Ambience, Music, Management","Cocktails, Drinks, Sauce, Chicken","Plot 38, S 1/10- 16, Aamchi Colony, N.D.A Pashan Road, Aundh, Pune",73.781504184,18.5164096844,https://www.zomato.com/pune/the-bar-tales-aundh,"₹1,500 for two people (approx.) with alcohol"
18597932,JM Housefull Partha,"North Indian, Chinese",3.9,134,3.9,134.0,4.0,2004,11am – 11:30pm (Today),"Prompt Service, Tasty Food, Worth the Money, Good Food, Staff, Value for Money","Bahubali Thali, Parantha Thali, Lassi, Parathas, Biryani","CIFCO Building, Near Peter England Store, JM Road, Pune",73.8456183672,18.5199372861,https://www.zomato.com/pune/jm-housefull-partha-jm-road,₹400 for two people (approx.)
19141635,Moshi Moshi,"Asian, Chinese, Thai, Japanese, Sushi",4.3,706,4.3,706.0,3.9,942,"12noon – 4pm, 7pm – 11pm (Today)","Great Taste Value for Money, Ambience is very Nice, Economical Price, Fair Prices, Ambience was Super Cool, Good Hospitality","Yellow Curry Chicken, Veggie Tempura, Spicy Vegetable, Salmon Sashimi, Tuna Nigiri, Salmon Nigiri","Shop 7, 8, 9, Raksha Lekha CHS, Lane 5, Koregaon Park, Pune",73.8973430917,18.5343028642,https://www.zomato.com/pune/moshi-moshi-koregaon-park,"₹1,500 for two people (approx.)"
18634572,Yenna Dosa,South Indian,4.0,268,4.0,268.0,4.3,7163,6:30am – 9pm (Today),"Polite Staff, Packing, Quick Service, Good Taste, Worth the Money, Best Place","Thatte Idli, Filtered Coffee, Mysore Masala Dosa, Sambhar, Chutneys, Vada","Otta 248, Opposite Kothari Blocks, Bibvewadi, Pune",73.8605931401,18.478520579,https://www.zomato.com/pune/yenna-dosa-bibvewadi,₹350 for two people (approx.)
6503070,TGI Fridays,"American, Mexican, Italian, Salad, Desserts",4.1,1346,4.1,1346.0,3.9,585,11am – 12midnight (Today),"Unlimited Refills, Happy Hour, Good Offers, Rooftop Ambience, Nice Music, Great Music","Garden Burger, Fajita, Onion Rings, Mashed Potatoes, Cocktails, Nachos","3rd Floor, Seasons Mall, Magarpatta, Hadapsar, Pune",73.9317880198,18.5190919527,https://www.zomato.com/pune/tgi-fridays-hadapsar,"₹2,000 for two people (approx.) with alcohol"
18654949,7th Heaven Cake Shop,"Bakery, Desserts",3.6,60,3.6,60.0,4.3,7711,10:30am – 10pm (Today),"Pretty Decor, Reasonable Prices, Amazing Taste, Customer Service, Perfect Presentation, Worth the Money","Brownie Cake, Dark Chocolate Pastry, Macaroon, Chocolate Lava Cake, Chocolate Ganache, Cupcakes","Shop 5 & 6, Survey 1/3, 4, 5 B, Anand Nilay Society, Karve Road, Near Bank Of Maharashtra, Kothrud, Pune",73.8149382547,18.5015313447,https://www.zomato.com/pune/7th-heaven-cake-shop-1-kothrud,₹350 for two people (approx.)
18479892,Keventers Milkshakes and Desserts,"Beverages, Ice Cream, Desserts",3.3,394,3.3,394.0,4.0,1259,10am – 11pm (Today),"Concept, Great Taste, Best Place, Prices, Good Place, Service","Chocolate Oreo, Kit Kat Shake, Strawberry Shake, Thick Shakes, Milkshake, Drink","Survey 22, Food Court, 2nd Floor, Phoenix Market City, Viman Nagar, Pune",73.9166686,18.5627811,https://www.zomato.com/pune/keventers-milkshakes-and-desserts-viman-nagar,₹300 for two people (approx.)
18422366,Slice of Soul (S.O.S.),"Pizza, Fast Food, Beverages, Desserts",4.2,778,4.2,778.0,3.7,4757,11am – 11pm (Today),"Make your own Pizza, Concept, Cozy Place, Decent Place, Interior, Decor","Garlic Bread with Cheese, Onion Rings, Pizzas, Salads","Ram Nagar, Wadgaon Sheri, Pune",73.9190217108,18.5513893646,https://www.zomato.com/pune/slice-of-soul-s-o-s-wadgaon-sheri,₹700 for two people (approx.)
10943,Baker's Hut,"Bakery, Desserts",4.5,391,4.5,391.0,4.1,232,8:30am – 9pm (Today),"Owner, Best Place, Good Place, Price, Ambiance, Quality","Chocolate Pudding, Walnut Cake, Veg Puff, Donuts, Pastries, Cakes","Shop 6, Plot B-8, Varlaxmi Apartment, Sector 25, Sindhu Nagar, Nigdi, Pune",73.7698074058,18.6569514967,https://www.zomato.com/pune/bakers-hut-nigdi,₹350 for two people (approx.)
6507631,Savya Rasa,"South Indian, Mangalorean, Kerala, Chettinad, Beverages",4.9,1309,4.9,1309.0,4.2,627,"12noon – 3pm, 7pm – 10pm (Today)","Clean Bathrooms, Sophisticated, Worth the Price, Warm Ambience, Serving Size, Soothing Music","Bun Paratha, Pallipalayam Kozhi, Palm Sugar, Vegetable Stew, Neer Dosa, Filtered Coffee","Flat 2, Survey 479 & 480, Gera Serenity, North Main Road, Koregaon Park, Pune",73.8866206259,18.5388616142,https://www.zomato.com/pune/savya-rasa-koregaon-park,"₹2,100 for two people (approx.) Without alcohol"
18385829,Anaya Family Resto,"North Indian, Chinese, Kerala, Biryani, Beverages",4.1,374,4.1,374.0,4.0,17.9K,"11:30am – 3:30pm, 7pm – 11pm (Today)","Combos, Affordable Price, Nice Taste, Nice Food, Portion Size, Good Quantity","Kadala Curry, Veg Korma, Kerala Parotta, Chicken Masala, Jeera Rice, Chicken Tandoori","Ganesham A, Govind Garden Chowk, Near Gold's Gym, Pimple Saudagar, Pune",73.8052564859,18.5974539632,https://www.zomato.com/pune/anaya-family-resto-pimple-saudagar,₹600 for two people (approx.)
18757075,Odisha Hotel,"North Indian, Odia, Beverages",4.2,376,4.2,376.0,4.0,1238,1pm – 11pm (Today),"Ample Seating Area, Authenticity, Hygiene, Staff, Good Place, Ambience","Badi Chura, Begun Bhaja, Rice Kheer, Crab, Mutton Thali, Mutton Curry","Shop C-1 & 2, Adora CHS, Hinjewadi-Wakad Road, Near Laxmi Chowk, Wakad, Pune",73.7401351333,18.6008861502,https://www.zomato.com/pune/odisha-hotel-wakad,₹600 for two people (approx.)
19654461,Bun'ee Heist,"Desserts, Bakery, Fast Food",3.5,21,3.5,21.0,3.7,689,7am – 1am (Today),"Proper Packaging, Best Food under Best Budget, Mouth Watering Food, Perfect Presentation, Fresh Food with Good Quality, Packing","Cinnamon Roll, New York Cheesecake, Blueberry Cheesecake, Cake","Raw House 4, Dutta Mandir Chowk, Nandgaon, Opposite Lunkad Gardens, Viman Nagar, Pune",73.9141584011,18.5669630213,https://www.zomato.com/pune/bunee-heist-viman-nagar,₹250 for two people (approx.)
19326848,Spice Court,"North Indian, Chinese, Continental, Mughlai, Seafood, Beverages",4.0,89,4.0,89.0,3.8,71,11am – 11pm (Today),"Pocket Friendly Good Food, Parking Space, Family Crowd, Elaborate Menu, Best Food under Best Budget, Customizable Food","Hot Chocolate Roll, Dal Makhni, Mocktails, Starter, Soup, Drinks","90/1/1, Baner, Pune",73.7692716345,18.560495342,https://www.zomato.com/pune/spice-court-baner,"₹1,200 for two people (approx.) Without alcohol"
19337042,Biryani By Kilo,"Biryani, Mughlai, Kebab, Hyderabadi",3.9,117,3.9,117.0,3.9,2955,10am – 12midnight (Today),"Cutlery, Contactless Delivery, Wonderful Presentation, Spill Proof Packaging, Hygiene, Food Presentation","Dum Murgh, Vegetable Dum Biryani, Chicken Ghee Roast, Tender Chicken, Paneer 65, Phirni","Unit 122, Survey 21/1, Ganga Boulevard, Mohamadwadi, NIBM Road, Pune",73.908814,18.463381,https://www.zomato.com/pune/biryani-by-kilo-nibm-road,₹700 for two people (approx.)
11365,Mad Over Donuts,"Desserts, Beverages, Shake, Cafe",4.3,487,4.3,487.0,4.1,3421,11am – 11pm (Today),"Reasonable Price, Perfect Place, Best Place, Seating, Flavour, Prices","Doughnut, Chocolate Decadence, Cupcakes, Waffles, Hot Chocolate, Coffee","LG-9, Phoenix Market City, Nagar Road, Viman Nagar, Pune",73.9168762788,18.5632719503,https://www.zomato.com/pune/mad-over-donuts-viman-nagar,₹400 for two people (approx.)
18436023,Sassy Teaspoon,"Bakery, Desserts",4.3,430,4.3,430.0,4.3,1855,10am – 10:30pm (Today),"Live Music, Vibe, Great Ambience, Courteous Staff, Presentation, Great Service","Hazelnut Mousse, Macaroons, Blueberry Cheesecake, Cupcakes, Red Velvet, Deserts","Lane 7, Sanskriti Lifestyle Complex, Koregaon Park, Pune",73.8988924026,18.5339442879,https://www.zomato.com/pune/sassy-teaspoon-koregaon-park,₹300 for two people (approx.)
18341560,Big Daddy's,"Burger, Fast Food, Beverages, Wraps, Shake",3.8,280,3.8,280.0,4.0,16.8K,11am – 11pm (Today),"Quality and Quantity, Room Temperature, Good Portions, Spill Proof Packaging, Prompt Service, Contactless Delivery","Chicken Bucket, Chicken Popcorn, Fried Chicken, Wings, White Sauce Pasta, Brownie","Survey 63, C t s 582, Pasvli Sankul, K D Parvati, Kondhwa, Pune",73.9023437,18.4812565,https://www.zomato.com/pune/big-daddys-kondhwa,₹400 for two people (approx.)
10728,Venky's Xprs,"Fast Food, North Indian, Burger",4.2,394,4.2,394.0,4.1,1730,11am – 11pm (Today),"Best Place, Location, Prices, Good Place, Good Food, Value for Money","Pepper Roast Chicken, Chicken Lollipops, Chicken Nuggets, Chicken Tandoori, Burger","Survey 1216/6 B, Near Times Of India, FC Road, Pune",73.8411186263,18.5214346509,https://www.zomato.com/pune/venkys-xprs-fc-road,₹400 for two people (approx.)
18575827,Hakuna Matata,"North Indian, Chinese, Fast Food",4.2,2533,4.2,2533.0,3.1,194,11:30am – 11pm (Today),"Pet Friendly, Good Bartenders, Service and Quality of Food, Calm, Cozy Ambience, Perfect Evening","Chicken Slider, Chicken Maggi, Chicken Cafreal, Cheese Fondue, Buffalo Wings, Stroganoff","Survey 573, Jangali Maharaj Road, Shivaji Nagar, Pune",73.845619373,18.5196727821,https://www.zomato.com/pune/hakuna-matata-shivaji-nagar,"₹1,600 for two people (approx.) with alcohol"
18784864,TRP - The Rooftop Project,"North Indian, Asian, Italian",4.2,507,4.2,507.0,4.0,122,12noon – 12midnight (Today),"Resonable Rates, Rooftop Place, Amazing View, Great View, Lovely Ambience, Nice View","Chocolate Mud Pie, Karari Roti, Sangria, Tiramisu, Cocktails, Dal","6th Floor, Tej House, Camp, MG Road, Pune",73.8791614026,18.5165470257,https://www.zomato.com/pune/trp-the-rooftop-project-mg-road,"₹1,200 for two people (approx.) Without alcohol"
19271205,La Pino'z Pizza,"Pizza, Fast Food, Beverages",3.7,163,3.7,163.0,3.7,1364,11am – 11pm (Today),"Weekend Brunch, Interior, Wonderful Presentation, Good Wifi, Tamper Proof Packaging, Student Crowd","Veg Hawaiian Pizza, Melted Chocolate, Taco, Margarita Pizza, Shakes, Garlic Bread","Shop 3, Ground Floor, Shri Ganesh Imperia Square, Wakad, Pune",73.7610157952,18.6013195777,https://www.zomato.com/pune/la-pinoz-pizza-wakad,₹650 for two people (approx.)
6503255,Havmor Ice Cream,"Ice Cream, Desserts, Beverages, Shake",4.0,206,4.0,206.0,4.4,922,11am – 11pm (Today),"Good Place, Prices, Nice Place, Ambiance, Quality, Service","Chocolate Addiction, Ice Cream Sandwich, Belgium Chocolate, Sundae, Cookie, Ice Creams","Kalamkar Paradise Building, Balewadi Phata, Baner, Pune",73.7833995,18.5631219332,https://www.zomato.com/pune/havmor-ice-cream-baner,₹300 for two people (approx.)
18432295,Upsouth,"South Indian, Fast Food, Beverages, Desserts",4.2,1539,4.2,1539.0,3.5,5227,7am – 11pm (Today),"Loved it, Self Service, Inexpensive, Combos, Cute Little Place, Hygienic Place","Ghee Roast Dosa, Dosa Combo, Filter Kaapi, Sponge Dosa, Filtered Coffee, Healthy Breakfast","Shop 2, 3 & 4, 10, 12, Konark Estate, Dutt Mandir Chowk, Viman Nagar, Pune",73.9141357318,18.5641018092,https://www.zomato.com/pune/upsouth-1-viman-nagar,₹300 for two people (approx.)
10866,Badshah,"North Indian, South Indian, Pizza, Italian, Sandwich, Street Food, Desserts, Beverages",3.6,186,3.6,186.0,3.4,57,10:30am – 10pm (Today),"Waiter, Good Place, Quantity, Staff, Service, Ambience","Falooda, Pav Bhaji, Snacks, Coffee","Shop 1, 7, Dr Coyaji Road, Opposite Victory Theater, Camp Area, Pune",73.8798470423,18.5143616328,https://www.zomato.com/pune/badshah-camp-area,₹650 for two people (approx.)
18365592,Krishna Veg,"North Indian, South Indian, Chinese, Fast Food, Mughlai, Beverages, Desserts, Shake",3.7,389,3.7,389.0,3.8,14.2K,"8am – 11am, 11:30am – 3pm, 7pm – 11pm (Today)","Good and Nice to Enjoy, Affordable, Good for Large Groups, Waiter, Great Taste, Quick Service","Paneer Tikka Masala, Sizzler, Buffet, Pav Bhaji, Soup","Plot 166/5, Sector 25, Appughar Road, Nigdi, Pune",73.7666833028,18.6619739078,https://www.zomato.com/pune/krishna-veg-nigdi,₹800 for two people (approx.)
10139,Tiranga,"North Indian, Biryani",4.2,459,4.2,459.0,4.0,642,"11:55am – 4:15pm, 6:35pm – 11pm (Today)","Nice Delivery, Best Services, Nice Packaging, Decorations, Good Delivery, Ample Seating Area","Gavran Chicken, Mutton Thali, Dal Fry, Paneer Butter Masala, Chicken Dum Biryani, Veg Biryani","Near Baba Computer, Estate Road, Juna Pul Gate, Camp Area, Pune",73.8792123646,18.5075620655,https://www.zomato.com/pune/tiranga-camp-area,₹800 for two people (approx.)
19540167,Rohit Wadewale,"Street Food, Shake",2.6,20,2.6,20.0,3.6,1517,12:01am – 12midnight (Today),"Spill Proof Packaging, Extensive Menu, Great Portions, Timely Service, Spicy, Good Quality","Vada Pav, Pav Bhaji, Corn, Snacks","3, 241/1, Ozone Spring, Dange Chowk Link Road, Wakad, Pune",73.763714768,18.5945857572,https://www.zomato.com/pune/rohit-wadewale-wakad,₹200 for two people (approx.)
19755058,Rajeshahi Biryani's,Biryani,3.7,41,3.7,41.0,3.8,207,11:30am – 11pm (Today),"Amazing Interiors, Awesome Spot to Hangout, Comforting Atmosphere, Tamper Proof Packaging, Contactless Delivery, Cleanliness","Gulabjamun, Chicken Keema, Egg Biryani, Chicken Dum Biryani, Chicken Handi, Mutton Biryani","Chilekar Nagar, Bramha Park Society, Wakad, Pune",73.774089,18.5966956,https://www.zomato.com/pune/rajeshahi-biryanis-wakad,₹350 for two people (approx.)
19211040,Teritree,"North Indian, Chinese, Continental, Kebab, Mughlai, Desserts, Beverages",4.1,319,4.1,319.0,4.0,426,12noon – 11pm (Today),"Amazing Food and Experience, Ambience is very Nice, Service is Great, Parking, Elaborate Menu, Family Crowd","Chocolate Fudge, Cocktails, Cheesecake, Soup, Desserts, Starters","Survey 158, Near Konark Bella Vista, Magarpatta Road, Hadapsar, Pune",73.9303513616,18.5065001552,https://www.zomato.com/pune/teritree-hadapsar,"₹1,600 for two people (approx.) Without alcohol"
6506423,Hotel Sinhgad Chaupati,"North Indian, Chinese, Seafood, Biryani, Mughlai",3.9,261,3.9,261.0,3.8,5583,"12noon – 3pm, 7pm – 11pm (Today)","Tasty, Owner, Ambiance, Great Place, Good Service, Experience","Mandeli Fry, Surmai Tawa Fry, Jowar Bhakri, Chicken Maratha, Crab, Seafood","Near Rajaram Bridge, DP Road, Karve Nagar, Pune",73.8287056983,18.4917516382,https://www.zomato.com/pune/hotel-sinhgad-chaupati-karve-nagar,₹800 for two people (approx.)
13210,Indian Tadka Taste Punjab Da,"North Indian, Chinese, Mughlai, Biryani",4.2,717,4.2,717.0,3.9,16.9K,11am – 12midnight (Today),"Online Service, Jain Food Options, Variety of Veg Options, Great Buffet Spread, Pocket Friendly Place, Good for Large Groups","Masala Corn, Spicy Mutton, Paneer Parantha, Grilled Chicken Steak, Dal Khichdi, Chicken Lollipop","Survey 141/3, Magar Wasti, Magarpatta, Pune",73.9284134656,18.5067141275,https://www.zomato.com/pune/indian-tadka-taste-punjab-da-magarpatta,₹500 for two people (approx.)
10563,McDonald's,"Burger, Fast Food, Coffee, Desserts",3.7,919,3.7,919.0,4.1,9060,"12midnight – 12:55am, 9:05am – 12midnight (Today)","Comfortable Seating, Great Recommendations, Cute Little Place, Good Crowd, Inexpensive, Nice Crowd","Chicken Mcgrill, Mocha Frappe, Big Spicy Chicken Wrap, Cappuccino, Hot Coffee, French Fries","Shop 8-14, Stellar Enclave, D.P. Road, Aundh, Pune",73.8076285645,18.5624783204,https://www.zomato.com/pune/mcdonalds-aundh,₹500 for two people (approx.)
18310168,Yaron Da Adda - Dil Se Punjabi,"North Indian, Chinese",4.2,390,4.2,390.0,3.9,4501,"7am – 4:30pm, 5:30pm – 12midnight (Today)","Bang for the Buck, Economical, Office Crowd, Cozy Ambiance, Great Recommendations, Combos","Paneer Onion Kulcha, Punjabi Kulcha, Tandoori Kulcha, Amritsari Chhole, Shahi Paneer, Authentic Punjabi Food","Shop 2, Opposite World of Sweets, Wakad, Pune",73.7638522,18.5949048,https://www.zomato.com/pune/yaron-da-adda-dil-se-punjabi-wakad,₹500 for two people (approx.)
12463,Hotel Malwani Solkadi,"Maharashtrian, Seafood, Biryani, Malwani, North Indian",4.0,140,4.0,140.0,3.9,512,"11am – 4pm, 7pm – 11pm (Today)","Malwani Cuisine, Malwani Food, Quality of Food, Reasonable Prices, Polite Staff, Prompt Service","Sea Food, Seafood, Chicken Thali, Fish, Prawns","Shop 1, Saptashrungi Apartments, Near Renuka Swarup School, Shedge Aali, Sadashiv Peth, Pune",73.8490244374,18.5098721746,https://www.zomato.com/pune/hotel-malwani-solkadi-1-sadashiv-peth,₹500 for two people (approx.)
