restId,name,cuisine,aggregate_rating,rating_votes,dining_rating,dining_review_count,delivery_rating,delivery_review_count,timing,people_say,top_dishes,address,location_longitude,location_latitude,url,cost_for_two
10077,Marrakesh,"Lebanese, North Indian, Mughlai, Biryani, Rolls, Desserts",4.1,1682,4.1,1682.0,4.0,11.7K,11am – 11:30pm (Today),"Boneless Chicken Biryani, Relaxed Atmosphere, Good Packaging, Recommended Place, More Variety, Best Quality","Murg Kali Mirch, Zatar Naan, Falafel Shawarma, Murg Nizami, Garlic Hummus, Chicken Shawarama","Shop 8, Landmark Shopping Complex, Near Bishops School, Kalyani Nagar, Pune",73.9057162777,18.5486932994,https://www.zomato.com/pune/marrakesh-kalyani-nagar,₹500 for two people (approx.)
6506419,Hot Momo's And Burger,"Momos, Chinese, Burger, Fast Food, Beverages",3.7,276,3.7,276.0,4.0,12.2K,11am – 11pm (Today),"Combos, Reasonable Prices, Good Taste, Location, Best Place, Good Food","Chicken Momo, Ice Tea, Burgers, Fried Rice, Sandwiches","Shop 6, SR 199, Lunkad Dream Land, Haveli- North of Mutha River, Viman Nagar, Pune",73.9162161201,18.565296532,https://www.zomato.com/pune/hot-momos-and-burger-viman-nagar,₹500 for two people (approx.)
10219,Coffee House,"Chinese, North Indian, South Indian, Fast Food, Street Food, Beverages, Shake",4.0,598,4.0,598.0,4.2,952,8am – 10:30pm (Today),"Good for Large Groups, Family Place, Breakfast, Quick Service, Prompt Service, Location","Filtered Coffee, Dahi Wada, Mysore Masala Dosa, Sambhar, Juices, Dosa","2A, Moledina Road, Near Dorabjees, Camp Area, Pune",73.8773375005,18.5189101053,https://www.zomato.com/pune/coffee-house-camp-area,₹750 for two people (approx.)
19323399,Wake And Bake,"Desserts, Bakery",3.8,23,3.8,23.0,4.5,140,11am – 11pm (Today),"Great Menu, Clean and Hygienic Place, Nice Concept, Cleanliness, Wonderful Presentation, Perfect Presentation","French Dessert, Eclairs, Pastries, Desserts","Shop 1, Ground Floor, Trimurti Niwas, Baner Mahalunge Road, Baner, Pune",73.7878600135,18.5613970454,https://www.zomato.com/pune/wake-and-bake-1-baner,₹250 for two people (approx.)
13912,Shiv Sagar,"North Indian, South Indian, Chinese, Fast Food, Street Food, Mexican, Italian, Beverages",3.5,515,3.5,515.0,3.8,4203,9am – 11pm (Today),"Peaceful Ambience, Efficient Service, Themed Decor, Pure Veg, Family Restaurant, Good Staff","Paneer Butter Masala, Dal Tadka, Garlic Naan, Breads, Ice Cream, Desserts","A Wing, Lunkad Sky Cruise, Viman Nagar, Pune",73.9106756821,18.5657967938,https://www.zomato.com/pune/shiv-sagar-viman-nagar,₹900 for two people (approx.)
19339153,Circle of Crust,"Pizza, Fast Food",3.9,84,3.9,84.0,4.2,2349,11am – 11pm (Today),"Best Staff, Clean, Served Quickly, Wonderful Presentation, Low Price, Excellent Taste","Pepperoni, Chicken Lasagna, Cheese Garlic Bread, Chicken Pizza, Wings, Pizzas","Shop 4, Rahul Residency, Salunkhe Vihar Society, Near HDFC Bank, Salunkhe Vihar Road, Pune",73.902132,18.481019,https://www.zomato.com/pune/circle-of-crust-salunkhe-vihar-road,₹500 for two people (approx.)
6503195,Appa,"South Indian, Maharashtrian",3.9,138,3.9,138.0,4.3,1896,8am – 8pm (Today),"Pocket Friendly, Packaging, Quality, Experience, Ambience, Service","Khichdi Kakdi, Batata Vada, Idli Sambar, Khichadi, Misal, Chutney","759/92, Tamhane Building, Opposite Tilak Tank, Prabhat Road, Lane 1, Deccan Gymkhana, Pune",73.839151226,18.51357477,https://www.zomato.com/pune/appa-deccan-gymkhana,₹300 for two people (approx.)
18621250,FML - Food Music Love,"North Indian, Mughlai, Chinese, Fast Food, Continental, Beverages, Desserts",4.3,3043,4.3,3043.0,3.3,66,12noon – 12midnight (Today),"The Staff are very Friendly, Best Prize, Affordable Food, Good Server, Pleasant Environment, Ambiance and Music","Tandoori Fish Tikka, Barbeque Burger, Tangdi Chicken, Farmhouse Pizza, Chicken Popcorn, Crispy Corn","S35/35a, 2nd Floor, Seasons Mall, Magarpatta, Hadapsar, Magarpatta, Pune",73.9302883,18.5196315,https://www.zomato.com/pune/fml-food-music-love-magarpatta,"₹1,600 for two people (approx.) with alcohol"
18417619,Copper Chimney,"North Indian, Mughlai",4.3,1859,4.3,1859.0,4.0,463,Opens at 7pm,"Themed Decor, Comfortable Seating Area, Good Value, Great Host, Friendly Service, Fantastic Service","Dal Maharaja, Kadak Roomali, Bhatti Chicken, Rogan Josh Curry, Chura Paratha, Mutton Seekh Kebab","3rd Floor, Phoenix Market City Mall, Viman Nagar, Pune",73.9167743549,18.5621900447,https://www.zomato.com/pune/copper-chimney-viman-nagar,"₹1,200 for two people (approx.) Without alcohol"
6503522,Maratha Samrat,"Maharashtrian, Biryani, North Indian, Seafood",4.5,1178,4.5,1178.0,4.3,2787,11am – 11pm (Today),"Comfortable Seating Area, Cozy, Great Quality, Decent Ambience, Great Value, Host","Varadhi Chicken Sukka, Kala Mutton Thali, Chicken Masala Papad, Kala Chicken, Seafood Thali, Pandhra Rassa","Rohan Chambers, Karve Statue Square, Rahul Nagar Road, Near Jalsampatti Bhavan, Kothrud, Pune",73.8159289956,18.5017396002,https://www.zomato.com/pune/maratha-samrat-kothrud,"₹1,100 for two people (approx.)"
6504610,Vrundavan,"North Indian, Chinese, Malwani, Kebab",3.9,351,3.9,351.0,3.7,10.4K,11am – 1am (Today),"Economical, Cozy Ambiance, Cute Little Place, Friendly Service, Good Crowd, Good Quality Food","Punjabi Dum Aloo, Sweet Chicken, Fried Rice Chicken, Tandoori Chicken, Fish, Biryani","Shingote Plaza, Manjari Road, Near The Deccan Merchant Co Operative Bank, Hadapsar, Pune",73.9519682899,18.5006334588,https://www.zomato.com/pune/vrundavan-hadapsar,₹700 for two people (approx.)
12900,Saundarya Garden,"North Indian, Chinese, Maharashtrian, Desserts, Beverages, Shake",3.9,1086,3.9,1086.0,4.1,404,11am – 10pm (Today),"Good Customer Service, Pleasant Ambience, Family Restaurant, Comfortable Seating Area, Best Restaurant, Live Music","Seafood, Tandoori Roti, Sea Food, Butter Naan, Tandoori Chicken, Dal Tadka","Hinjewadi Road, Near Infotech Park, Hinjawadi, Pune",73.7525044754,18.5912014281,https://www.zomato.com/pune/saundarya-garden-hinjawadi,"₹1,200 for two people (approx.) Without alcohol"
19533250,Hyderabad Vibes,"Biryani, Chinese, Fast Food",3.7,65,3.7,65.0,3.4,369,11am – 11pm (Today),"Very Affordable, Filling Food, Great Veg Options, Delicious Taste, Mouth Watering Food, Healthy and Delicious","Briyani, Chicken 65, Chicken Biryani, Starter, Rice","Shop 3, Ground Floor, Nirmal C.H.S, Sangamwadi, Dhole Patil Road, Pune",73.8758585975,18.5366761886,https://www.zomato.com/pune/hyderabad-vibes-dhole-patil-road,₹500 for two people (approx.)
12588,Christy Restaurant,"North Indian, Chinese, Biryani, Street Food, Fast Food",3.9,484,3.9,484.0,3.7,27.5K,11am – 1am (Today),"Delivery Instructions, Keto Options, Good and Nice to Enjoy, Jain Food Options, Fusion Dishes, Good for Large Groups","Chicken Hakeemi, Veg Manchurian Noodles, Anda Masala, Anda Curry, Veg Biriyani, Egg Thali","Survey 139, Walekharwadi, Near Gurudwara, Chinchwad, Pune",73.7625372782,18.6483433909,https://www.zomato.com/pune/christy-restaurant-chinchwad,₹500 for two people (approx.)
10104,Sheetal Arch Restaurant,"North Indian, South Indian, Chinese, Street Food, Pasta, Desserts, Shake",3.7,153,3.7,153.0,4.1,803,11am – 1am (Today),"Good Service, Ambiance, Staff, Food Quality, Experience, Good Food","Cheese Garlic Naan, Pav Bhaji, Thali, Starters","11, Virwani Plaza, Dr. Koyagi Road, Camp, East Street, Pune",73.8806574047,18.5126667736,https://www.zomato.com/pune/sheetal-arch-restaurant-east-street,₹800 for two people (approx.) Without alcohol
18661262,The Daily All Day,"European, Asian, Continental, Italian, Beverages",4.6,1219,4.6,1219.0,4.1,911,12noon – 10pm (Today),"Service is Great, Lightings, Themed Decor, Good for Large Groups, Fancy Crowd, Good Vibe","Drunken Prawn, Whiskey Cocktail, Mushroom Crostini, Cajun Chicken, Mud Cake, Ravioli","Near State Bank Of India, Lane 7, Koregaon Park, Pune",73.899567984,18.5340615882,https://www.zomato.com/pune/the-daily-all-day-1-koregaon-park,"₹2,000 for two people (approx.) Without alcohol"
18649596,Burger King,"Burger, Fast Food, Beverages, Desserts",3.5,181,3.5,181.0,4.1,3689,10am – 2am (Today),"Pocket Friendly, Great Recommendations, Cleanliness, Polite Staff, Great Ambiance, Wonderful Presentation","Veg Pattice, Supreme Burger, Crispy Chicken, Wraps","S 430A/1, Lower Ground Floor, Unit 1, The Pavilion Mall, Shivaji Nagar, Senapati Bapat Road, Pune",73.8298043981,18.5332271328,https://www.zomato.com/pune/burger-king-1-senapati-bapat-road,₹400 for two people (approx.)
11045,Palavi,"Chinese, Fast Food, North Indian, South Indian, Street Food, Beverages, Desserts, Shake",3.0,361,3.0,361.0,4.1,10K,8am – 11pm (Today),"Great Food, Good Place, Ambiance, Good Service, Good Food","Pavbhaji, Paneer Tikka Masala, Pav Bhaji, Starters","Plot 10, Rambaug Colony, Paud Road, Opposite Anandnagar Park, Kothrud, Pune",73.8144055009,18.5097949172,https://www.zomato.com/pune/palavi-kothrud,₹500 for two people (approx.)
13279,Chitale Bandhu Mithaiwale,"Mithai, Ice Cream, Desserts",4.6,727,4.6,727.0,4.5,2902,8:30am – 8:30pm (Today),"Location, Best Place, Value for Money, Food Quality, Quantity, Service","Amba Barfis, Bhakarwadi, Chitale Bandhu, Amrakhand, Farsan, Sweets","759/54, Deccan Gymkhana, Pune",73.8417033479,18.5155846805,https://www.zomato.com/pune/chitale-bandhu-mithaiwale-deccan-gymkhana,₹300 for two people (approx.)
18565613,Degchi's Biryani Cafe,"Biryani, Momos, Fast Food, North Indian",3.8,167,3.8,167.0,3.9,1676,11am – 11pm (Today),"Good Food Good Quality, Economical, Cordial Staff, Prompt Service, Cafe, Packing","Dum Biryani, Kebabs, Chicken Biryani, Desserts","Rose Avenue, Salunkhe Vihar Road, Pune",73.8939256221,18.4823297406,https://www.zomato.com/pune/degchis-biryani-cafe-salunkhe-vihar-road,₹500 for two people (approx.)
18778821,7th Heaven,"Bakery, Desserts",4.3,572,4.3,572.0,4.3,3912,11am – 11pm (Today),"Pretty Decor, Loved it, Fresh, Good Customer Service, Design, Wonderful Presentation","Swiss Chocolate Cake, Choco Chip Brownie, Fresh Fruit Cake, Ferrero Rocher Cake, Mango Cheesecake, Chocolate Truffle","Shop 6, Stilt Floor, SR 292/1, 2, 3, 5/7, Pride Valencia, Pan Card Club Road, Baner, Pune",73.7812537327,18.5594115118,https://www.zomato.com/pune/7th-heaven-baner,₹400 for two people (approx.)
6506108,Burger King,"Burger, Fast Food, Beverages, Desserts",3.9,1254,3.9,1254.0,3.7,24.6K,10am – 12midnight (Today),"Fresh Air, Inexpensive, Decent Ambience, Cleanliness, Seat, Fast Service","Spicy Chicken Royale, Mutton Whooper, Chicken Whooper, Whooper Burger, Grilled Patty, Finger Chips","Survey 207, Unit S-25, 2nd Floor, Phoenix Market City, Viman Nagar, Pune",73.9170549,18.5625606,https://www.zomato.com/pune/burger-king-viman-nagar,₹400 for two people (approx.)
10814,Giridhar,"North Indian, Street Food",4.0,224,4.0,224.0,4.1,515,8:30am – 11pm (Today),"Breakfast, Good Place, Food, Taste","Misal Pav, Poha, Chai, Tea","Shop 7, Swajas Complex, Parihar Chowk, Aundh, Pune",73.8093867525,18.5608510021,https://www.zomato.com/pune/giridhar-aundh,₹300 for two people (approx.)
19243169,Buon Cibo- The Italian Cafe,"Mexican, Italian, Continental, Pizza, Pasta",4.4,377,4.4,377.0,4.3,1496,11am – 11pm (Today),"Ambience is very Nice, Serving Time, Authenticity, Ambience was Super Cool, Variety of Pizza, Customizable Dishes","Risotto, Choco Lava, Hummus, Tacos, Salsa, Thin Crust Pizza","Shop 01, Survey 62/1/4, Axis Centra, Baner, Pune",73.7707431614,18.5573700145,https://www.zomato.com/pune/buon-cibo-the-italian-cafe-baner,₹700 for two people (approx.)
18617210,Spice Factory,"North Indian, Chinese, Mughlai, Beverages",4.1,3026,4.1,3026.0,3.9,3178,12noon – 12midnight (Today),"Great Food Great Service, Music and Ambience, Good Food and Good Service, Service Charges, Rooftop Ambience, Great View","Sweet Soup, Kofta Curry, Honey Chilli Potatoes, Nachos N Salsa, Veg Manchow, Chicken Popcorn","2nd Floor, White Square, Hinjawadi Wakad Road, Near Hinjawadi, Pune",73.7528883666,18.5910803537,https://www.zomato.com/pune/spice-factory-hinjawadi,"₹2,000 for two people (approx.) with alcohol"
18350016,Chulbul Dhaba,"North Indian, Chinese",4.1,3304,4.1,3304.0,3.8,14.4K,11am – 11:30pm (Today),"Good Quality with Good Taste, Food was Wonderful, Dhaba Feel, Boneless Chicken Biryani, Peaceful Environment, Cheap","Mushroom Paratha, Veg Kohlapuri, Matka Murgh, Chilli Paneer Dry, Chicken Dilruba, Kaju Curry","Survey 6/2/23, Haveli, South Main Road, Opposite Zensar IT Park, Kharadi, Pune",73.942563124,18.5494733255,https://www.zomato.com/pune/chulbul-dhaba-kharadi,₹800 for two people (approx.)
10860,Mathura Pure Veg,"Fast Food, Maharashtrian, North Indian, Street Food, Beverages, Shake",4.1,762,4.1,762.0,4.1,2039,"12noon – 3:30pm, 6:30pm – 11pm (Today)","Serving Size, Good for Large Groups, Pure Veg, Contactless Delivery, Perfect Presentation, Decent Place","Shrikhand Puri, Thali Peeth, Gavran Thali, Matki Usal, Kothimbir Wadi, Tawa Pulav","1262/A, Prestige Chambers, Sai Service, JM Road, Pune",73.8448023051,18.5190064336,https://www.zomato.com/pune/mathura-pure-veg-jm-road,₹600 for two people (approx.)
11608,Mayur Pav Bhaji & Juice Bar,"Street Food, North Indian, Chinese, Beverages, Shake",4.2,376,4.2,376.0,4.3,1221,6pm – 11pm (Today),"Family Place, Chinese, Spicy, Best Place, Good Place, Food Quality","Tawa Pulav, Pavbhaji, Masala Papad, Coffee","7, Sushil Ganga Apartments, Samarth Path, Karve Nagar, Pune",73.8252449781,18.492769443,https://www.zomato.com/pune/mayur-pav-bhaji-juice-bar-karve-nagar,₹500 for two people (approx.)
19696202,Jai Malhar Pure Non-Veg Restaurant,"North Indian, Malwani",3.4,15,3.4,15.0,3.7,132,11am – 11pm (Today),"Fresh Food with Good Quality, Wonderful Presentation, Worth the Money, Great Portions, Timely Service, Delicious Food","Mutton Rassa, Mutton Sukka, Mutton Thali, Biryani","Shop 04, Ganga Housing, Ambedkar Chowk, Pune University, Pune",73.828791,18.562516,https://www.zomato.com/pune/jai-malhar-pure-non-veg-restaurant-pune-university,₹400 for two people (approx.)
19680973,Sadda Punjab,"North Indian, Mughlai, Chinese, Street Food",3.6,26,3.6,26.0,3.7,190,"11am – 3:30pm, 6pm – 11pm (Today)","Food Quantity, Wonderful Presentation, Perfect Presentation, Fresh Food with Good Quality, Worth the Money, Great Taste","Authentic Punjabi Food, Hakka Noodles, Tandoori Chicken, Butter Chicken","11-12, Nande Road, Mahalunge, Pune",73.7626566365,18.5702148623,https://www.zomato.com/pune/sadda-punjab-mahalunge,₹500 for two people (approx.)
6507448,Cafe Peter,"Cafe, Desserts, Korean, Fast Food, Japanese, Beverages, Steak",4.2,1607,4.2,1607.0,3.8,4756,7am – 1am (Today),"Budget Friendly Meal, Free Wifi, Breakfasts, Comfortable Seating, Cozy Ambience, Brunch","Cinnamon Sugar Donut, Bingsu, Classic Hot Chocolate, Spanish Omelette, Mocha Frappe, Mocha Coffee","Opposite Symbosis International College, Anand Square, Viman Nagar, Pune",73.9077537507,18.5651636795,https://www.zomato.com/pune/cafe-peter-viman-nagar,₹900 for two people (approx.)
10565,McDonald's,"Burger, Fast Food, Coffee, Desserts",3.9,678,3.9,678.0,4.1,10.1K,10am – 2am (Today),"Excellent Food Service, Good and Nice to Enjoy, Casual Seating Area, Drive through, Not very Crowded, Office Crowd","Mcaloo Tikki Burger, Spicy Chicken Wrap, Maharaja Chicken, Chocolate Frappe, Burgers, Fries","Survey 127, Gopal House, Karve Road, Kothrud, Pune",73.8216950744,18.5047012513,https://www.zomato.com/pune/mcdonalds-kothrud,₹500 for two people (approx.)
6505073,Paramhans Pure Veg,"Rajasthani, North Indian, Chinese",4.1,415,4.1,415.0,3.9,2211,Opens at 7pm,"Pure Veg, Clean Place, Authentic Taste, Reasonable Price, Hygiene, Quick Service","Dal Bati Churma Thali, Churma, Daal Bati, Veg Thali, Naan","Survey 124/4, Shop 4, Near Prabhavee Tech Park, Baner Road, Baner, Pune",73.7788756192,18.5642737557,https://www.zomato.com/pune/paramhans-pure-veg-baner,₹400 for two people (approx.)
19100997,Indori Sarafa,Street Food,3.8,98,3.8,98.0,3.9,9450,7am – 4am (Today),"Large Servings, Spill Proof Packaging, Wonderful Presentation, Fast Delivery, Best Quality, Best Food","Desi Ghee Jalebi, Aloo Kachori, Pyaz Kachori, Dahi Vada, Poha, Aloo Paratha","Survey 147/1, 1371, Wakad Road, Near IDBI Bank, Hinjawadi, Pune",73.7400221452,18.5912007925,https://www.zomato.com/pune/indori-sarafa-hinjawadi,₹150 for two people (approx.)
18284385,Open Window Cafe Bistro,"Italian, Continental, Salad, Thai, Beverages, Shake",4.1,907,4.1,907.0,4.2,441,11am – 12midnight (Today),"Rooftop Cafe, Amazing View, Pretty Place, Beautiful View, Great View, Good View","Kitkat Shake, Spicy Chicken, Peri Peri Chicken, Potato Wedges, Cheese Balls, Shakes","Plot 499, Survey 1125-A, 6th Floor, Shivaji Nagar, Pune",73.8412363082,18.5283150486,https://www.zomato.com/pune/open-window-cafe-bistro-shivaji-nagar,"₹1,300 for two people (approx.) Without alcohol"
19293784,Ambarsariya Authentic Amritsari,"North Indian, Mughlai, Beverages, Biryani, Desserts",4.0,275,4.0,275.0,3.9,1196,"11:30am – 4pm, 6:30pm – 11pm (Today)","Family Favorite, Service is Great and Fast, Authentic Food, Customizable Dishes, Wonderful Presentation, Contactless Delivery","Smoked Butter Chicken, Authentic Punjabi Food, Soya Chaap, Paneer Lababdar, Fish Tikka, Kulcha","Shop A2, Nirman Altius, Near Radisson Blu Hotel, Off Nagar Bypass Road, Pandhari Nagar, Kharadi, Pune",73.9386551455,18.5524827814,https://www.zomato.com/pune/ambarsariya-authentic-amritsari-kharadi,₹900 for two people (approx.)
6505212,KFC,"Burger, Fast Food, Beverages, Desserts, Biryani",2.6,663,2.6,663.0,3.9,15.4K,10am – 12midnight (Today),"Pocket Friendly, Order Online, Great Recommendations, Low Price, Good Crowd, Great Ambiance","Saucy Chicken, Choco Lash, Fiery Chicken, Rice Bowl, Burgers","Shop 1, 2 & 3, Ground Floor, Spot 18 Mall, Rahatani Village, Haveli Taluk, Pimple Saudagar, Pune",73.7857658789,18.5934999192,https://www.zomato.com/pune/kfc-pimple-saudagar,₹400 for two people (approx.)
11209,The Eatery - Four Points by Sheraton,"North Indian, Asian, Italian, Mughlai, Desserts, Beverages, South Indian",4.0,313,4.0,313.0,3.2,126,7am – 10pm (Today),"Menu Options, Ample Seating Area, Breakfast, Family Crowd, Courteous Staff, Live Music","Dinner Buffet, Sunday Brunch, Fish, Dessert","Four Points by Sheraton, Plot 197/3, 5th Mile Stone, Nagar Road, Viman Nagar, Pune",73.9222034812,18.5624414517,https://www.zomato.com/pune/the-eatery-four-points-by-sheraton-1-viman-nagar,"₹2,000 for two people (approx.) Without alcohol"
11940,Modern Cafe,"North Indian, South Indian, Chinese, Fast Food, Shake",3.3,248,3.3,248.0,3.9,141,7:30am – 11:30pm (Today),"Location, Nice Place, Good Place, Ambiance, Good Food, Price","Cut Dosa, Masala Dosa, Filter Coffee, Chutney","364/65, Shivaji Nagar, Pune",73.8515403494,18.5270021262,https://www.zomato.com/pune/modern-cafe-shivaji-nagar,₹600 for two people (approx.)
18473491,The Blue Plate,"Continental, Pasta, Salad, Desserts, Beverages",4.5,824,4.5,824.0,4.1,3237,12noon – 11pm (Today),"Bang for the Buck, Not very Crowded, Quality of Food, Cozy Ambience, Cosy Place, Reasonable Prices","Brownie Custard, Hazelnut Custard, Bacon Flatbread, Tomato Basil Soup, Peri Chicken, Cheese Garlic Bread","Shop 3 E, Chaitraban Society, Opposite Croma Mall, Aundh, Pune",73.8068644702,18.553403916,https://www.zomato.com/pune/the-blue-plate-aundh,₹700 for two people (approx.)
6505646,Feast - Sheraton Grand,"North Indian, Asian, European",4.4,639,4.4,639.0,3.2,51,8am – 10pm (Today),"Sophisticated, Worth the Price, Courteous Service, Fancy Crowd, Great Hospitality, Breakfast","Dinner Buffet, Lamb, Salads, Sea Food, Seafood, Deserts","Sheraton Grand, 100/101, Raja Bahadur Mill Road, Near Bund Garden Road, Pune",73.8715251535,18.5299172454,https://www.zomato.com/pune/feast-sheraton-grand-bund-garden,"₹3,000 for two people (approx.) Without alcohol"
19878952,Hapaa - Asian Stir,"Asian, Japanese, Chinese, Beverages",4.0,138,4.0,138.0,4.1,182,7:30am – 11:30pm (Today),"Best in Service, Sanitised Service, Amazing Restaurant, Bartender, Nice Concept, Appetizers","Pork Chilli, Chicken Spicy, Dimsums, Honey Chilli Potato, Dumplings, Prawns","Survey 209/1/2/3, CTS 2109/21, Kalyani Nagar, Pune",73.9034508153,18.5483455677,https://www.zomato.com/pune/hapaa-asian-stir-1-kalyani-nagar,"₹1,800 for two people (approx.) Without alcohol"
19232686,Café Buddy's Espresso,"Cafe, Fast Food, Beverages",3.7,30,3.7,30.0,3.7,4,10am – 10pm (Today),"Good Wifi, Outdoor Seating, Weekend Brunch, Family Crowd, Good Music, Student Crowd","Chicken Tikka Sandwich, Cappuccino, Brownie, Pizza","Shop 8, Baner - Pashan Link Road, Echelon, Opposite Regent Plaza, Baner, Pune",73.7930085137,18.5520819686,https://www.zomato.com/pune/café-buddys-espresso-baner,₹500 for two people (approx.)
12056,Vohuman Cafe,"Street Food, Beverages",4.8,3537,4.8,3537.0,4.5,2489,6am – 7pm (Today),"Breakfast Joint, Economical, Not very Crowded, Cafe, Reasonable Prices, Favorite Place","Toast Butter Cheese, Double Egg Cheese Omelette, Maska Pav, Egg Fry, Egg Burji, Anda Bhurji","Shop 13, Millennium Star Building, Near Ruby Hall Hospital, Dhole Patil Road, Pune",73.8766538724,18.5325732349,https://www.zomato.com/pune/vohuman-cafe-dhole-patil-road,₹200 for two people (approx.)
11882,The Flour Works,"European, American, Bakery, Salad, Beverages, Sandwich, Italian, Desserts",4.2,2330,4.2,2330.0,4.1,1217,7am – 1am (Today),"Breakfasts, Peaceful Ambience, Nice Menu, Valet Service, Brilliant Place, Service and Quality of Food","Melon Breezer, Mushroom Tartlets, Custard Quartet, Warm Chicken Salad, Lamb Bourguignon, Chai Latte","Commercial 3, Nirvana, North Avenue, Near Jogger's Park, Kalyani Nagar, Pune",73.9009352401,18.5496967797,https://www.zomato.com/pune/the-flour-works-kalyani-nagar,"₹1,300 for two people (approx.) Without alcohol"
18801797,House Of Momos,"Momos, Fast Food",3.7,130,3.7,130.0,4.2,4457,11am – 11pm (Today),"Cozy Ambiance, Low Price, Reasonable Prices, Amazing Food, Prompt Service, Food Presentation","Manchurian Momo, Chicken Momo, Tandoori Momos, Veg Momos, Sauce","Shop B-3, La-Regallia, Near Akurdi Railway Station, Nigdi, Pune",73.7655577809,18.6484666483,https://www.zomato.com/pune/house-of-momos-1-nigdi,₹350 for two people (approx.)
6503149,Jagaat Bhaari Kolhapuri,Maharashtrian,4.1,344,4.1,344.0,4.3,4124,Opens at 7pm,"Great Taste, Tasty Food, Best Place, Value for Money, Good Service, Prices","Butter Roti, Misal Pav, Tandoori Roti, Rice","Opposite City Pride, Near Bhapkar Petrol Pump, Satara Road, Pune",73.8571622595,18.4881493681,https://www.zomato.com/pune/jagaat-bhaari-kolhapuri-satara-road,₹150 for two people (approx.)
18341529,Raaga Multi Cuisine Restaurant,"North Indian, Mughlai, Maharashtrian, Malwani",4.0,384,4.0,384.0,4.0,654,Opens at 7pm,"Fast Service, Nice Ambience, Food Taste, Quick Service, Manager, Main Course","Gulabjamun, Sea Food, Seafood, Soups, Naan, Starter","Sai Darshan Building, Near Akurdi Police Chouki, Nigdi, Pune",73.7672633305,18.6512796243,https://www.zomato.com/pune/raaga-multi-cuisine-restaurant-nigdi,"₹1,000 for two people (approx.)"
18401550,Fly High,"Continental, Fast Food, Chinese",4.1,1306,4.1,1306.0,4.0,155,11am – 10pm (Today),"Good Bartenders, Happy Hour, Classy Ambience, Rooftop Ambience, Great Host, Outdoor Sitting","Kamikaze, Cocktails, Beer, Nachos, Drinks, Pasta","1st Floor, Westend Mall, Aundh, Pune",73.8070032746,18.5615181409,https://www.zomato.com/pune/fly-high-aundh,"₹2,000 for two people (approx.) Without alcohol"
6506690,Cheesiano Pizza,"Italian, Fast Food, Pizza",4.1,588,4.1,588.0,3.7,6284,11am – 11pm (Today),"Nice Crowd, Reasonable Prices, Combos, Prompt Service, Polite Staff, Seating Arrangement","Garlic Bread with Cheese, Chicken Tikka Pizza, Cheese Burst, Chicken Popcorn, Sides, Sauce","Shop 2, Ground Floor, Survey 45/1-28, Raja Mantri Road, Karve Nagar, Pune",73.8330535591,18.4972669806,https://www.zomato.com/pune/cheesiano-pizza-karve-nagar,₹500 for two people (approx.)
6506170,Cafe Uniq Aroma,"Cafe, Fast Food",3.8,109,3.8,109.0,4.1,1083,9:30am – 10pm (Today),"Cafe, Owner, Good Place, Prices, Good Food, Menu","Hazelnut Frappe, Sandwiches, Salad, Burger, Coffee","C-3/4, Sunscape Apartments, Opposite Income Tax Office, Pradhikaran, Nigdi, Pune",73.7665847316,18.6499444592,https://www.zomato.com/pune/cafe-uniq-aroma-nigdi,₹350 for two people (approx.)
6505010,Tasty Punjab,"North Indian, Chinese, Mughlai, Rolls",3.6,381,3.6,381.0,3.8,13.3K,10:30am – 12:30am (Today),"Themed Decor, Relaxed Atmosphere, Packed on Weekends, Fast Delivery, Family Crowd, Decent Place","Veg Maharaja, Mushroom Masala, Chicken Handi, Tandoori Roti","151, Near Noble Hospital, Magarpatta, Pune",73.9277864993,18.5055768601,https://www.zomato.com/pune/tasty-punjab-magarpatta,₹800 for two people (approx.)
12108,Vicki's,"Italian, Salad, Fast Food, Sandwich, Burger, Desserts",4.1,215,4.1,215.0,4.1,4983,10am – 9pm (Today),"Cafe, Packing, Prices, Menu, Good Food, Quality","Salads, Sandwiches, Brownie, Burgers, Pizza","Shop 26, Bizz Bay Mall, NIBM Road, Pune",73.8999304175,18.4698847033,https://www.zomato.com/pune/vickis-nibm-road,₹500 for two people (approx.)
12957,Venky's Xprs,"Fast Food, North Indian, Burger",3.8,207,3.8,207.0,4.1,1552,10:30am – 10:30pm (Today),"Nice Place, Good Place, Menu, Good Food, Packaging, Quantity","Grilled Chicken, Chicken Lollipop, Tandoori Chicken, Burgers, Meat","6, Rushikeshdham, Parihar Chowk, DP Road, Aundh, Pune",73.8089187071,18.5604931172,https://www.zomato.com/pune/venkys-xprs-aundh,₹400 for two people (approx.)
